{
    "$schema": "https://json-schema.org/draft/2019-09/schema",
    "$id": "https://github.com/fermyon/spin-plugins/json-schema/spin-plugin-manifest-schema-0.1.json",
    "type": "object",
    "title": "spin-plugin-manifest-schema-0.1",
    "required": [
        "name",
        "description",
        "version",
        "spinCompatibility",
        "license",
        "packages"
    ],
    "properties": {
        "name": {
            "type": "string"
        },
        "description": {
            "type": "string"
        },
        "homepage": {
            "type": "string"
        },
        "version": {
            "type": "string"
        },
        "spinCompatibility": {
            "type": "string",
            "pattern": "^([><~^*]?[=]?v?(0|[1-9]\\d*)(\\.(0|[1-9]\\d*))?(\\.(0|[1-9]\\d*))?(-(0|[1-9]\\d*|\\d*[a-zA-Z-][0-9a-zA-Z-]*)(\\.(0|[1-9]\\d*|\\d*[a-zA-Z-][0-9a-zA-Z-]*))*)?(\\+[0-9a-zA-Z-]+(\\.[0-9a-zA-Z-]+)*)?)(?:, *([><~^*]?[=]?v?(0|[1-9]\\d*)(\\.(0|[1-9]\\d*))?(\\.(0|[1-9]\\d*))?(-(0|[1-9]\\d*|\\d*[a-zA-Z-][0-9a-zA-Z-]*)(\\.(0|[1-9]\\d*|\\d*[a-zA-Z-][0-9a-zA-Z-]*))*)?(\\+[0-9a-zA-Z-]+(\\.[0-9a-zA-Z-]+)*)?))*$"
        },
        "license": {
            "type": "string"
        },
        "packages": {
            "type": "array",
            "minItems": 1,
            "items": {
                "type": "object",
                "required": [
                    "os",
                    "arch",
                    "url",
                    "sha256"
                ],
                "properties": {
                    "os": {
                        "type": "string",
                        "enum": [
                            "linux",
                            "macos",
                            "windows"
                        ]
                    },
                    "arch": {
                        "type": "string",
                        "enum": [
                            "x86",
                            "x86_64",
                            "arm",
                            "aarch64"
                        ]
                    },
                    "url": {
                        "type": "string"
                    },
                    "sha256": {
                        "type": "string"
                    }
                },
                "additionalProperties": false
            }
        }
    },
    "additionalProperties": false
}