{
    "name": "example",
    "description": "A description of the plugin.",
    "homepage": "www.example.com",
    "version": "0.2.0",
    "spinCompatibility": ">=0.4",
    "license": "Apache-2.0",
    "packages": [
        {
            "os": "linux",
            "arch": "x86_64",
            "url": "https://raw.githubusercontent.com/fermyon/spin-plugins/main/example/example.tar.gz",
            "sha256": "7827de0de5e1f5660b9685a43c8011549c1bd41dd52c458dc03ef6d33704ea16"
        },
        {
            "os": "macos",
            "arch": "aarch64",
            "url": "https://raw.githubusercontent.com/fermyon/spin-plugins/main/example/example.tar.gz",
            "sha256": "7827de0de5e1f5660b9685a43c8011549c1bd41dd52c458dc03ef6d33704ea16"
        }
    ]
}
